Var,Human,Demo/Exam/Quest/Lab/Mort,Data,ForceInc
PFQ055,Need special equipment to walk,Q,0,0
PFQ056,Experience confusion/memory problems,Q,0,0
PFQ058,Check item,Q,0,0
PFQ059,"Physical, mental, emotional limitations",Q,0,0
PFQ059A,Check item,Q,0,0
PFQ060A,Managing money difficulty,Q,0,0
PFQ060B,Walking for quarter mile difficulty,Q,0,0
PFQ060C,Walking up 10 steps difficulty,Q,0,0
PFQ060D,"Stooping, crouching, kneeling difficulty",Q,0,0
PFQ060E,Lifting or carrying difficulty,Q,0,0
PFQ060F,House chore difficulty,Q,0,0
PFQ060G,Preparing meals difficulty,Q,0,0
PFQ060H,Walking between rooms on same floor,Q,0,0
PFQ060I,Standing up from armless chair difficulty,Q,0,0
PFQ060J,Getting in and out of bed difficulty,Q,0,0
PFQ060K,"Using fork, knife, drinking from cup",Q,0,0
PFQ060L,Dressing yourself difficulty,Q,0,0
PFQ060M,Standing for long periods difficulty,Q,0,0
PFQ060N,Sitting for long periods difficulty,Q,0,0
PFQ060O,Reaching up over head difficulty,Q,0,0
PFQ060P,Grasp/holding small objects difficulty,Q,0,0
PFQ060Q,"Going out to movies, events difficulty",Q,0,0
PFQ060R,Attending social event difficulty,Q,0,0
PFQ060S,Leisure activity at home difficulty,Q,0,0
PFQ066,Check item,Q,0,0
PFD067A,Health problems causing difficulty,Q,0,0
PFD067B,Health problems causing difficulty,Q,0,0
PFD067C,Health problems causing difficulty,Q,0,0
PFD067D,Health problems causing difficulty,Q,0,0
PFD067E,Health problems causing difficulty,Q,0,0
PFD069AG,Arthritis or rheumatism problems (not in NHANES 01-02),Q,0,0
PFD069AQ,Number of days weeks months years (not in NHANES 01-02),Q,0,0
PFD069AU,Unit of measure (day week month year) (not in NHANES 01-02),Q,0,0
PFD069BG,Back or neck problems (not in NHANES 01-02),Q,0,0
PFD069BQ,Number of days weeks months years (not in NHANES 01-02),Q,0,0
PFD069BU,Unit of measure (day week month year) (not in NHANES 01-02),Q,0,0
PFD069CG,"Cancer conditions, days (not in NHANES 01-02)",Q,0,0
PFD069CQ,Number of days weeks months years (not in NHANES 01-02),Q,0,0
PFD069CU,Unit of measure (day week month year) (not in NHANES 01-02),Q,0,0
PFD069DG,Depression anxiety emotional problems (not in NHANES 01-02),Q,0,0
PFD069DQ,Number of days weeks months years (not in NHANES 01-02),Q,0,0
PFD069DU,Unit of measure (day week month year) (not in NHANES 01-02),Q,0,0
PFD069EG,Other development problems (not in NHANES 01-02),Q,0,0
PFD069EQ,Number of days weeks months years (not in NHANES 01-02),Q,0,0
PFD069EU,Unit of measure (day week month year) (not in NHANES 01-02),Q,0,0
PFD069FG,Diabetes condition (not in NHANES 01-02),Q,0,0
PFD069FQ,Number of days weeks months years (not in NHANES 01-02),Q,0,0
PFD069FU,Unit of measure (day week month year) (not in NHANES 01-02),Q,0,0
PFD069GG,Fractures bone joint injury problems (not in NHANES 01-02),Q,0,0
PFD069GQ,Number of days weeks months years (not in NHANES 01-02),Q,0,0
PFD069GU,Unit of measure (day week month year) (not in NHANES 01-02),Q,0,0
PFD069HG,"Hearing problems, days (not in NHANES 01-02)",Q,0,0
PFD069HQ,Number of days weeks months years (not in NHANES 01-02),Q,0,0
PFD069HU,Unit of measure (day week month year) (not in NHANES 01-02),Q,0,0
PFD069IG,Heart problems (not in NHANES 01-02),Q,0,0
PFD069IQ,Number of days weeks months years (not in NHANES 01-02),Q,0,0
PFD069IU,Unit of measure (day week month year) (not in NHANES 01-02),Q,0,0
PFD069JG,Hypertension (not in NHANES 01-02),Q,0,0
PFD069JQ,Number of days weeks months years (not in NHANES 01-02),Q,0,0
PFD069JU,Unit of measure (day week month year) (not in NHANES 01-02),Q,0,0
PFD069KG,Lung or breathing problems (not in NHANES 01-02),Q,0,0
PFD069KQ,Number of days weeks months years (not in NHANES 01-02),Q,0,0
PFD069KU,Unit of measure (day week month year) (not in NHANES 01-02),Q,0,0
PFD069LG,Mental retardation condition (not in NHANES 01-02),Q,0,0
PFD069LQ,Number of days weeks months years (not in NHANES 01-02),Q,0,0
PFD069LU,Unit of measure (day week month year) (not in NHANES 01-02),Q,0,0
PFD069MG,Other injury problems (not in NHANES 01-02),Q,0,0
PFD069MQ,Number of days weeks months years (not in NHANES 01-02),Q,0,0
PFD069MU,Unit of measure (day week month year) (not in NHANES 01-02),Q,0,0
PFD069NG,Senility condition (not in NHANES 01-02),Q,0,0
PFD069NQ,Number of days weeks months years (not in NHANES 01-02),Q,0,0
PFD069NU,Unit of measure (day week month year) (not in NHANES 01-02),Q,0,0
PFD069OG,Stroke problems (not in NHANES 01-02),Q,0,0
PFD069OQ,Number of days weeks months years (not in NHANES 01-02),Q,0,0
PFD069OU,Unit of measure (day week month year) (not in NHANES 01-02),Q,0,0
PFD069PG,Vision problems (not in NHANES 01-02),Q,0,0
PFD069PQ,Number of days weeks months years (not in NHANES 01-02),Q,0,0
PFD069PU,Unit of measure (day week month year) (not in NHANES 01-02),Q,0,0
PFD069QG,Weight problems (not in NHANES 01-02),Q,0,0
PFD069QQ,Number of days weeks months years (not in NHANES 01-02),Q,0,0
PFD069QU,Unit of measure (day week month year) (not in NHANES 01-02),Q,0,0
PFD069RG,Other impairment problems (not in NHANES 01-02),Q,0,0
PFD069RQ,Number of days weeks months years (not in NHANES 01-02),Q,0,0
PFD069RU,Unit of measure (day week month year) (not in NHANES 01-02),Q,0,0
PFD069A,Arthritis or rheumatism problems days (not in NHANES 99-00),Q,0,0
PFD069B,Back or neck problems days (not in NHANES 99-00),Q,0,0
PFD069C,Cancer conditions days (not in NHANES 99-00),Q,0,0
PFD069D,Depression anxiety emotional problems days (not in NHANES 99-00),Q,0,0
PFD069E,Other development problems days (not in NHANES 99-00),Q,0,0
PFD069F,Diabetes condition days (not in NHANES 99-00),Q,0,0
PFD069G,Fractures bone joint injury problems days (not in NHANES 99-00),Q,0,0
PFD069H,Hearing problems days (not in NHANES 99-00),Q,0,0
PFD069I,Heart problems days (not in NHANES 99-00),Q,0,0
PFD069J,Hypertension days (not in NHANES 99-00),Q,0,0
PFD069K,Lung or breathing problems days (not in NHANES 99-00),Q,0,0
PFD069L,Mental retardation condition days (not in NHANES 99-00),Q,0,0
PFD069M,Other injury problems days (not in NHANES 99-00),Q,0,0
PFD069N,Senility condition days (not in NHANES 99-00),Q,0,0
PFD069O,Stroke problems days (not in NHANES 99-00),Q,0,0
PFD069P,Vision problems days (not in NHANES 99-00),Q,0,0
PFD069Q,Weight problems days (not in NHANES 99-00),Q,0,0
PFD069R,Other impairment problems days (not in NHANES 99-00),Q,0,0
PFQ090,Require special healthcare equipment,Q,0,0
PFQ100,Special eating utensils (not in NHANES 01-02),Q,0,0
PFQ110,Dressing aids or devices (not in NHANES 01-02),Q,0,0
RXD030,Taken prescription medicine past month,Q,0,0
RXD295,Number of prescription medicines taken (not in NHANES 01-02),Q,0,0
KIQ081,Usually have trouble trying to urinate (not in NHANES 99-00) (same as KIQ080),Q,0,0
KIQ101,Bladder feels empty after urinating (not in NHANES 99-00) (same as KIQ100),Q,0,0
KIQ106,Diagnosed with prostate disease (not in NHANES 99-00),Q,0,0
KIQ121,Diagnosed with enlarged prostate (not in NHANES 99-00) (same as KIQ120),Q,0,0
KIQ141,Enlargement was BPH (not in NHANES 99-00) (same as KIQ140),Q,0,0
KIQ161,Age at first BPH diagnosis (not in NHANES 99-00) (same as KIQ160),Q,0,0
KIQ170A,Check item (not in NHANES 99-00),Q,0,0
KID182,Enlargement due to prostate cancer (not in NHANES 99-00) (same as KIQ180),Q,0,0
KIQ321,Ever had a PSA test (not in NHANES 99-00),Q,0,0
KIQ341,Ever had a rectal exam (not in NHANES 99-00) (same as KIQ340),Q,0,0
KIQ361,DRE to check for prostate cancer (not in NHANES 99-00) (same as KIQ360),Q,0,0
KIQ381,DRE to check for blood in stool (not in NHANES 99-00) (same as KIQ380),Q,0,0
KIQ400,Ability to maintain an erection (not in NHANES 99-00),Q,0,0
SMQ020,Smoked at least 100 cigarettes in life,Q,0,0
SMD030,Age started smoking cigarettes regularly,Q,0,0
SMQ040,Do you now smoke cigarettes,Q,0,0
SMQ050Q,How long since quit smoking cigarettes,Q,0,0
SMQ050U,Unit of measure (day week month year),Q,0,0
SMQ053,Check item,Q,0,0
SMD055,Age last smoked cigarettes regularly,Q,0,0
SMD057,Number cigarettes smoked per day when quit,Q,0,0
SMD070,Number cigarettes smoked per day now,Q,0,0
SMD075,How many years smoked this amount,Q,0,0
SMQ077,How soon after waking do you smoke (not in NHANES 99-00),Q,0,0
SMD080,Number days smoked cigarettes past 30 days,Q,0,0
SMD090,Average number cigarettes per day during past 30 days,Q,0,0
SMD092,May I please see the pack of cigarettes (not in NHANES 99-00),Q,0,0
SMDUPCA,Cig 12-digit universal product code (not in NHANES 99-00),Q,0,0
SMD100BR,Cigarette brand or sub-brand,Q,0,0
SMD100FL,Filter type,Q,0,0
SMD100MN,Menthol indicator,Q,0,0
SMD100LN,Length in milllimeters,Q,0,0
SMD100TR,FTC tar content,Q,0,0
SMD100NI,FTC nicotine content,Q,0,0
SMD100CO,FTC carbon monoxide content,Q,0,0
SMD120,Smoked a pipe at least 20 times in life,Q,0,0
SMD130,Age started smoking pipe regularly,Q,0,0
SMD140,Do you now smoke a pipe,Q,0,0
SMQ143,Number pipefuls of tobacco smoked per day,Q,0,0
SMQ145,Number years smoked this amount of pipes,Q,0,0
SMQ150,Smoked cigars at least 20 times in life,Q,0,0
SMD160,Age started cigar smoking regularly,Q,0,0
SMQ170,Do you now smoke cigars,Q,0,0
SMQ173,Number cigars smokes per day,Q,0,0
SMQ175,Number years smoked this amount of cigars,Q,0,0
SMQ180,Used snuff at least 20 times in life,Q,0,0
SMQ190,Age started using snuff regularly,Q,0,0
SMQ200,Do you now use snuff,Q,0,0
SMD203,Number snuff pinches dips rubs per day,Q,0,0
SMQ205,Number years used this amount of snuff,Q,0,0
SMQ210,Used chewing tobacco 20 times in life,Q,0,0
SMD220,Age started chewing tobacco regularly,Q,0,0
SMD230,Do you now use chewing tobacco,Q,0,0
SMD233,Number chewing plugs wads chaws per day,Q,0,0
SMD235,Number years used this chewing tobacco amount,Q,0,0
VIQ030,General condition of eyesight,Q,0,0
VIQ040,Time worrying about eyesight,Q,0,0
VIQ050A,Difficulty reading ordinary newsprint,Q,0,0
VIQ050B,Difficulty with up close work or chores,Q,0,0
VIQ050C,Difficulty seeing steps or curbs under dim light,Q,0,0
VIQ050D,Difficulty noticing objects to side,Q,0,0
VIQ050E,Difficulty finding objects on crowded shelf,Q,0,0
VIQ055,Difficulty driving daytime in familiar place,Q,0,0
VIQ060,Vision limits how long can do activities,Q,0,0
VIQ070,Ever had cataract operation,Q,0,0
VIQ080,Operation in right left or both eyes,Q,0,0
PEASCST1,Blood Pressure Status,E,0,0
PEASCTM1,Blood Pressure Time in Seconds,E,0,0
PEASCCT1,Blood Pressure Comment,E,0,0
BPXCHR,60 sec HR (30 sec HR x 2),E,0,0
BPQ150A,Had food past 30 minutes,E,0,0
BPQ150B,Had alcohol past 30 minutes,E,0,0
BPQ150C,Had coffee past 30 minutes,E,0,0
BPQ150D,Had cigarettes past 30 minutes,E,0,0
BPAARM,Arm selected,E,0,0
BPACSZ,Cuff size (cm),E,0,0
BPXDB,Number of dropped beats in 30 seconds,E,0,0
BPXPULS,Pulse regular or irregular?,E,0,0
BPXPTY,Pulse type,E,0,0
BPXML1,MIL: maximum inflation levels (mm Hg),E,0,0
BPXSY1,SBP first reading (mm Hg),E,0,0
BPXDI1,DBP first reading (mm Hg),E,0,0
BPAEN1,Enhancement used first reading,E,0,0
BPXSY2,SBP second reading (mm Hg),E,0,0
BPXDI2,DBP second reading (mm Hg),E,0,0
BPAEN2,Enhancement used second reading,E,0,0
BPXSY3,SBP third reading (mm Hg),E,0,0
BPXDI3,DBP third reading (mm Hg),E,0,0
BPAEN3,Enhancement used third reading,E,0,0
BPXSY4,Systolic: Blood pressure (fourth reading if necessary) mm Hg,E,0,0
BPXDI4,Diastolic: Blood pressure (fourth reading if necessary) mm Hg,E,0,0
BPAEN4,Enhancement used fourth reading,E,0,0
BMAEXLEN,Length of a MEC exam (sec) (not in NHANES 01-02),E,0,0
BMAEXSTS,Status of a MEC exam (not in NHANES 01-02),E,0,0
BMAEXCMT,Comment code for an exam (not in NHANES 01-02),E,0,0
BMXWT,Weight (kg),E,0,0
BMIWT,Weight Comment,E,0,0
BMXRECUM,Recumbent Length (cm),E,0,0
BMIRECUM,Recumbent Length Comment,E,0,0
BMXHEAD,Head Circumference (cm),E,0,0
BMIHEAD,Head Circumference Comment,E,0,0
BMXHT,Standing Height (cm),E,0,0
BMIHT,Standing Height Comment,E,0,0
BMXLEG,Upper Leg Length (cm),E,0,0
BMILEG,Upper Leg Length Comment,E,0,0
BMXCALF,Maximal Calf Circumference (cm),E,0,0
BMICALF,Maximal Calf Comment,E,0,0
BMXARML,Upper Arm Length (cm),E,0,0
BMIARML,Upper Arm Length Comment,E,0,0
BMXARMC,Arm Circumference (cm),E,0,0
BMIARMC,Arm Circumference Comment,E,0,0
BMXWAIST,Waist Circumference (cm),E,0,0
BMIWAIST,Waist Circumference Comment,E,0,0
BMXTHICR,Thigh Circumference (cm),E,0,0
BMITHICR,Thigh Circumference Comment,E,0,0
BMXTRI,Triceps Skinfold (mm),E,0,0
BMITRI,Triceps Skinfold Comment,E,0,0
BMXSUB,Subscapular Skinfold (mm),E,0,0
BMISUB,Subscapular Skinfold Comment,E,0,0
BMAAMP,Amputations (not in NHANES 01-02),E,0,0
BMAUREXT,Amputations upper right extremity (not in NHANES 01-02),E,0,0
BMAUPREL,Amputations UR above or below elbow (not in NHANES 01-02),E,0,0
BMAULEXT,Amputations upper left extremity (not in NHANES 01-02),E,0,0
BMAUPLEL,Amputations UL above or below elbow (not in NHANES 01-02),E,0,0
BMALOREX,Amputations lower right extremity (not in NHANES 01-02),E,0,0
BMALORKN,Amputations LR above or below knee (not in NHANES 01-02),E,0,0
BMALLEXT,Amputations lower left extremity (not in NHANES 01-02),E,0,0
BMALLKNE,Amputations LL above or below knee (not in NHANES 01-02),E,0,0
DXAEXSTS,Exam Status,E,0,0
DXITOT,Overall Imputation Indicator,E,0,0
DXIHE,Head Imputation Indicator,E,0,0
DXXHEA,Head Area (cm2),E,0,0
DXAHEBV,Head Bone Invalidity Code,E,0,0
DXXHEBMC,Head Bone Mineral Content (grams),E,0,0
DXXHEBMD,Head Bone Mineral Density (grams/cm2),E,0,0
DXAHETV,Head Tissue Invalidity Code,E,0,0
DXXHEFAT,Head Fat (grams),E,0,0
DXDHELE,Head Lean excl Bone Mineral Content (grams),E,0,0
DXXHELI,Head Lean incl Bone Mineral Content (grams),E,0,0
DXDHETOT,Head Total (grams),E,0,0
DXDHEPF,Head Percent Fat,E,0,0
DXILA,Left Arm Imputation Indicator,E,0,0
DXXLAA,Left Arm Area (cm2),E,0,0
DXALABV,Left Arm Bone Invalidity Code,E,0,0
DXXLABMC,Left Arm Body Mineral Content (grams),E,0,0
DXXLABMD,Left Arm Body Mineral Density (grams/cm2),E,0,0
DXALATV,Left Arm Tissue Invalidity Code,E,0,0
DXXLAFAT,Left Arm Fat (grams),E,0,0
DXDLALE,Left Arm Lean excl Body Mineral Content (grams),E,0,0
DXXLALI,Left Arm Lean incl BMC (grams),E,0,0
DXDLATOT,Left Arm Total (grams),E,0,0
DXDLAPF,Left Arm Percent Fat,E,0,0
DXILL,Left Leg Imputation Indicator,E,0,0
DXXLLA,Left Leg Area(cm2),E,0,0
DXALLBV,Left Leg Bone Invalidity Code,E,0,0
DXXLLBMC,Left Leg Bone Mineral Content (grams),E,0,0
DXXLLBMD,Left Leg Bone Mineral Density (grams/cm2),E,0,0
DXALLTV,Left Leg Tissue Invalidity Code,E,0,0
DXXLLFAT,Left Leg Fat (grams),E,0,0
DXDLLLE,Left Leg Lean excl Bone Mineral Content (grams),E,0,0
DXXLLLI,Left Leg Lean incl Bone Mineral Content (grams),E,0,0
DXDLLTOT,Left Leg Total (grams),E,0,0
DXDLLPF,Left Leg Percent Fat,E,0,0
DXIRA,Right Arm Imputation Indicator,E,0,0
DXXRAA,Right Arm Area (cm2),E,0,0
DXARABV,Right Arm Bone Invalidity Code,E,0,0
DXXRABMC,Right Arm Bone Mineral Content (grams),E,0,0
DXXRABMD,Right Arm Bone Mineral Density (grams/cm2),E,0,0
DXARATV,Right Arm Tissue Invalidity Code,E,0,0
DXXRAFAT,Right Arm Fat (grams),E,0,0
DXDRALE,Right Arm Lean excl Bone Mineral Content (grams),E,0,0
DXXRALI,Right Arm Lean incl Bone Mineral Content (grams),E,0,0
DXDRATOT,Right Arm Total (grams),E,0,0
DXDRAPF,Right Arm Percent Fat,E,0,0
DXIRL,Right Leg Imputation Indicator,E,0,0
DXXRLA,Right Leg Area (cm2),E,0,0
DXARLBV,Right Leg Bone Invalidity Code,E,0,0
DXXRLBMC,Right Leg Bone Mineral Content (grams),E,0,0
DXXRLBMD,Right Leg Bone Mineral Density (grams/cm2),E,0,0
DXARLTV,Right Leg Tissue Invalidity Code,E,0,0
DXXRLFAT,Right Leg Fat (grams),E,0,0
DXDRLLE,Right Leg Lean excl Bone Mineral Content (grams),E,0,0
DXXRLLI,Right Leg Lean incl Bone Mineral Content (grams),E,0,0
DXDRLTOT,Right Leg Total (grams),E,0,0
DXDRLPF,Right Leg Percent Fat,E,0,0
DXILR,Left Ribs Imputation Indicator,E,0,0
DXXLRA,Left Ribs Area(cm2),E,0,0
DXXLRBMC,Left Ribs Bone Mineral Content (grams),E,0,0
DXXLRBMD,Left Ribs Bone Mineral Density (grams/cm2),E,0,0
DXIRR,Right Ribs Imputation Indicator,E,0,0
DXXRRA,Right Ribs Area (cm2),E,0,0
DXXRRBMC,Right Ribs Bone Mineral Content (grams),E,0,0
DXXRRBMD,Right Ribs Bone Mineral Density (grams/cm2),E,0,0
DXITS,Thoracic Spine Imputation Indicator,E,0,0
DXXTSA,Thoracic Spine Area (cm2),E,0,0
DXXTSBMC,Thoracic Spine Bone Mineral Content (grams),E,0,0
DXXTSBMD,Thoracic Spine Bone Mineral Density (grams/cm2),E,0,0
DXILS,Lumbar Spine Imputation Indicator,E,0,0
DXXLSA,Lumbar Spine Area (cm2),E,0,0
DXXLSBMC,Lumbar Spine Bone Mineral Content (grams),E,0,0
DXXLSBMD,Lumbar Spine Bone Mineral Density (grams/cm2),E,0,0
DXIPE,Pelvis Imputation Indicator,E,0,0
DXXPEA,Pelvis Area (cm2),E,0,0
DXXPEBMC,Pelvis Bone Mineral Content (grams),E,0,0
DXXPEBMD,Pelvis Bone Mineral Density (grams/cm2) ,E,0,0
DXITR,Trunk Imputation Indicator,E,0,0
DXDTRA,Trunk Bone area (cm2),E,0,0
DXATRBV,Trunk Bone Invalidity Code,E,0,0
DXDTRBMC,Trunk Bone Mineral Content (grams),E,0,0
DXDTRBMD,Trunk Bone BMD (g/cm2),E,0,0
DXATRTV,Trunk Tissue Invalidity Code,E,0,0
DXXTRFAT,Trunk Fat (grams),E,0,0
DXDTRLE,Trunk Lean excl Bone Mineral Content (grams),E,0,0
DXXTRLI,Trunk Lean incl Bone Mineral Content (grams),E,0,0
DXDTRTOT,Trunk Total (grams),E,0,0
DXDTRPF,Trunk Percent Fat,E,0,0
DXDSTA,Subtotal Area (cm2),E,0,0
DXDSTBMC,Subtotal Bone Mineral Content (grams),E,0,0
DXDSTBMD,Subtotal Bone Mineral Density (grams/cm2),E,0,0
DXDSTFAT,Subtotal Fat (g),E,0,0
DXDSTLE,Subtotal Lean excl BMC (g),E,0,0
DXDSTLI,Subtotal Lean incl BMC (g),E,0,0
DXDSTTOT,Subtotal (Total excl Head) (g),E,0,0
DXDSTPF,Subtotal Percent Fat,E,0,0
DXDTOA,Total Area (cm2),E,0,0
DXDTOBMC,Total Bone Mineral Content (g),E,0,0
DXDTOBMD,Total Bone Mineral Density (g/cm2),E,0,0
DXDTOFAT,Total Fat (g),E,0,0
DXDTOLE,Total Lean excl BMC (g),E,0,0
DXDTOLI,Total Lean incl BMC (g),E,0,0
DXDTOTOT,Total Lean+Fat(g),E,0,0
DXDTOPF,Total Percent Fat,E,0,0
LEDSCCT2,ABPI section comment (not in NHANES 99-00),E,0,0
LEAARM,Arm,E,0,0
LEAARMC,Arm comment (not in NHANES 99-00),E,0,0
LEDARMCF,Brachial cuff size,E,0,0
LEQ020,Large adult used poor thigh cuff fit (not in NHANES 99-00),E,0,0
LEAANKL,Ankles,E,0,0
LEAANKLC,Ankle comment (not in NHANES 99-00),E,0,0
LEDANKCF,Ankle cuff size,E,0,0
LEXBRP1,Brachial SBP 1,E,0,0
LEXBRP2,Brachial SBP 2,E,0,0
LEXBRPM,Mean Brachial SBP,E,0,0
LEXLPTS1,Left Posterior Tibial SBP 1,E,0,0
LEXLPTS2,Left Posterior Tibial SBP 2,E,0,0
LEXLPTSM,Left Mean Posterior Tibial SBP,E,0,0
LEXLABPI,Left ABPI,E,0,0
LEXRPTS1,Right Posterior Tibial SBP 1,E,0,0
LEXRPTS2,Right Posterior Tibial SBP 2,E,0,0
LEXRPTSM,Right Mean Posterior Tibial SBP,E,0,0
LEXRABPI,Right ABPI,E,0,0
LEALPTPD,Left PT pulse detected (not in NHANES 99-00),E,0,0
LEARPTPD,Right PT pulse detected (not in NHANES 99-00),E,0,0
LEALAPNC,Left ankle SBP more than 255 mmHg (not in NHANES 99-00),E,0,0
LEARAPNC,Right ankle SBP more than 255 mmHg (not in NHANES 99-00),E,0,0
LEDSCCT1,Peripheral neuropathy section comment (not in NHANES 99-00),E,0,0
LEALAMP,Left amputation,E,0,0
LEALBUN,Left bunions,E,0,0
LEALLES,Left lesion,E,0,0
LEALLESS,Left lesion site,E,0,0
LEARAMP,Right amputation,E,0,0
LEARBUN,Right bunions,E,0,0
LEARLES,Right lesion,E,0,0
LEARLESS,Right lesion site,E,0,0
LEXLMH11,Left metatarsal head 1 test 1,E,0,0
LEALM1C1,Left metatarsal head 1 comment test 1 ,E,0,0
LEXLHAL1,Left halux test 1,E,0,0
LEALHAC1,Left halux comment test 1 ,E,0,0
LEXLMH51,Left metatarsal head 5 test 1,E,0,0
LEALM5C1,Left metatarsal head 5 comment test 1,E,0,0
LEXLMH12,Left metatarsal head 1 test 2 ,E,0,0
LEALM1C2,Left metatarsal head 1 comment test 2,E,0,0
LEXLHAL2,Left halux test 2,E,0,0
LEALHAC2,Left halux comment test 2,E,0,0
LEXLMH52,Left metatarsal head 5 test 2,E,0,0
LEALM5C2,Left metatarsal head 5 comment test 2,E,0,0
LEXLMH13,Left metatarsal head 1 test 3,E,0,0
LEALM1C3,Left metatarsal head 1 comment test 3 (not in NHANES 99-00),E,0,0
LEXLHAL3,Left halux test 3,E,0,0
LEALHAC3,Left halux comment test 3 (not in NHANES 99-00),E,0,0
LEXLMH53,Left metatarsal head 5 test 3,E,0,0
LEALM5C3,Left metatarsal head 5 comment test 3 (not in NHANES 99-00),E,0,0
LEXRHAL1,Right halux test 1,E,0,0
LEARHAC1,Right halux comment test 1 ,E,0,0
LEXRMH11,Right metatarsal head 1 test 1,E,0,0
LEARM1C1,Right metatarsal head 1 comment test 1 ,E,0,0
LEXRMH51,Right metatarsal head 5 test 1,E,0,0
LEARM5C1,Right metatarsal head 5 comment test 1,E,0,0
LEXRHAL2,Right halux test 2,E,0,0
LEARHAC2,Right halux comment test 2,E,0,0
LEXRMH12,Right metatarsal head 1 test 2,E,0,0
LEARM1C2,Right metatarsal head 1 comment test 2,E,0,0
LEXRMH52,Right metatarsal head 5 test 2,E,0,0
LEARM5C2,Right metatarsal head 5 comment test 2,E,0,0
LEXRHAL3,Right halux test 3,E,0,0
LEARHAC3,Right halux comment test 3 (not in NHANES 01-02),E,0,0
LEXRMH13,Right metatarsal head 1 test 3 (not in NHANES 01-02),E,0,0
LEARM1C3,Right metatarsal head 1 comment test 3 (not in NHANES 01-02),E,0,0
LEXRMH53,Right metatarsal head 5 test 3,E,0,0
LEARM5C3,Right metatarsal head 5 comment test 3 (not in NHANES 99-00),E,0,0
LEALPN,Left foot number of insensate areas,E,0,0
LEARPN,Right foot number of insensate areas,E,0,0
MSAEXLEN,Timed walk and muscle strength time (sec),E,0,0
MSAEXSTS,Timed walk and muscle strength status,E,0,0
MSAEXCMT,Timed walk and muscle strength comments,E,0,0
MSDEXCLU,Exclusion criteria for muscle strength,E,0,0
MSDCWUA,Can SP walk unassisted (not in NHANES 99-00),E,0,0
MSXWTIME,Time to complete 20 feet walk (sec) ,E,0,0
MSXW08TM,Time to complete 8 feet walk (sec) (not in NHANES 99-00),E,0,0
MSXWPAIN,Pain reported on walking,E,0,0
MSAWDEV,Type of device used,E,0,0
MSDPTIME,Time to peak force in seconds,E,0,0
MSDPFANG,Angle of peak force (degrees),E,0,0
MSXARML,Arm length cm,E,0,0
MSXGRAV,Gravity correction in Lb,E,0,0
MSDPFVEL,Peak force velocity degree per seconds,E,0,0
MSDPF,Peak force (newtons),E,0,0
MSDNTR,Number of trials,E,0,0
MSDAPF,Average peak force (newtons),E,0,0
MSDPFTR,Selected peak force trial,E,0,0
SEQ010,Hemophilia (not in NHANES 01-02),E,0,0
SEQ020,Cancer chemotherapy past or future 4 weeks (not in NHANES 01-02),E,0,0
SEQ030,Pacemaker or automatic defibrillator (not in NHANES 01-02),E,0,0
SEQ040,Amputations of legs or feet other than toes (not in NHANES 01-02),E,0,0
SEQ050,Where is the amputation (not in NHANES 01-02),E,0,0
SEQ060,Are you currently pregnant (not in NHANES 01-02),E,0,0
SEQ070,How many weeks (not in NHANES 01-02),E,0,0
WHQ020L,How much weight without clothes or shoes (not in NHANES 01-02),E,0,0
SEQ080,CV exclusion and physician medical review (not in NHANES 01-02),E,0,0
URXUMA,Albumin urine (ug/mL),LAB,0,0
URXUCR,Creatinine urine (mg/dL),LAB,0,0
LBXBPB,Lead (ug/dL),LAB,0,0
LBDBPBSI,Lead (umol/L),LAB,0,0
LBXBCD,Cadmium (ug/L),LAB,0,0
LBDBCDSI,Cadmium (nmol/L),LAB,0,0
LBXEPP,Protoporphyrin (ug/dL RBC),LAB,0,0
LBDEPPSI,Protoporphyrin (umol/L RBC),LAB,0,0
LBXIRN,Iron (ug/dL),LAB,0,0
LBXTIB,Total iron binding capacity (ug/dL),LAB,0,0
LBXFER,Ferritin (ng/mL),LAB,0,0
LBXFOL,Folate serum (ng/mL),LAB,0,0
LBXB12,Vitamin B12 serum (pg/mL),LAB,0,0
LBXHCY,Homocysteine (umol/L) ,LAB,0,0
LBXMMA,Methylmalonic acid (umol/L),LAB,0,0
LBXTHG,Mercury total (ug/L),LAB,0,0
LBDTHGSI,Mercury total (umol/L),LAB,0,0
LBXIHG,Mercury inorganic (ug/L),LAB,0,0
LBDIHGSI,Mercury inorganic (umol/L),LAB,0,0
LBXRBF,Folate RBC (ng/mL RBC),LAB,0,0
LBDRBFSI,Folate RBC (nmol/L RBC),LAB,0,0
LBDCOTLC,Cotinine comment code (not in NHANES 99-00),LAB,0,0
LBDCOTSI ,Cotinine (nmol/L) (not in NHANES 01-02),LAB,0,0
LBXSEL,Selenium (ng/mL) (not in NHANES 01-02),LAB,0,0
LBDSELSI,Selenium (nmol/L) (not in NHANES 01-02),LAB,0,0
LBXGTC,Gamma tocopherol (ug/dL),LAB,0,0
LBDGTCSI,Gamma tocopherol (umol/L),LAB,0,0
LBXRPL,Retinyl palmitate (ug/dL),LAB,0,0
LBDRPLSI,Retinyl palmitate (umol/L),LAB,0,0
LBXRST,Retinyl stearate (ug/dL),LAB,0,0
LBDRSTSI,Retinyl stearate (umol/L),LAB,0,0
LBXVIA,Vitamin A (ug/dL) (not in NHANES 01-02),LAB,0,0
LBDVIASI,Vitamin A (umol/L) (not in NHANES 01-02),LAB,0,0
LBXVIE,Vitamin E (ug/dL),LAB,0,0
LBDVIESI,Vitamin E (umol/L),LAB,0,0
URXUHG,Mercury urine (ng/mL),LAB,0,0
SSCA125,Cancer antigen 125 (U/mL) (surplus) (not in NHANES 99-00),LAB,0,0
SSCA153,Cancer antigen 15.3 (mU/mL) (surplus) (not in NHANES 99-00),LAB,0,0
WTSAF2YR,2Yr AM(3-11) & fasting (12+) weights,LAB,0,0
WTSAF4YR,4Yr AM(3-11) & fasting (12+) weights,LAB,0,0
LBXTR,Triglyceride (mg/dL),LAB,0,0
LBDTRSI,Triglyceride (mmol/L),LAB,0,0
LBDLDL,LDL (mg/dL),LAB,0,0
LBDLDLSI,LDL (mmol/L),LAB,0,0
LBXTC,Total Cholesterol (mg/dL),LAB,0,0
LBDHDL,HDL (mg/dL),LAB,0,0
LBXHP1,Helicobacter pylori (ISR) (not in NHANES 01-02),LAB,0,0
LBXFB,Fibrinogen (mg/dL),LAB,0,0
LBXBAP,Bone alkaline phosphotase (ug/L),LAB,0,0
URXNT,N-telopeptides (Ntx) (nmol BCE),LAB,0,0
SSCYPC,Cystatin C (mg/L) (surplus),LAB,0,0
WTSCY4YR,Surplus sera cystatin 99-02 weights (surplus),LAB,0,0
SSMETSI,Methyltetrahydrofolate (pmol/ml) (surplus) (60-150) (not in NHANES 01-02),LAB,0,0
SSFOLSI,Folic acid (pmol/ml) (surplus) (60-150) (not in NHANES 01-02),LAB,0,0
SSFOLTSI,Total Folate (pmol/ml) (surplus) (60-150) (not in NHANES 01-02),LAB,0,0
SSMET,Methyltetrahydrofolate (ng/ml) (surplus) (60-150) (not in NHANES 01-02),LAB,0,0
SSFOL,Folic acid (ng/ml) (surplus) (60-150) (not in NHANES 01-02),LAB,0,0
SSFOLTOT,Total Folate (ng/ml) (surplus) (60-150) (not in NHANES 01-02),LAB,0,0
WTSSCB2Y,Cardiac biomarkers 2 year weights,LAB,0,0
WTSSCB4Y,Cardiac biomarkers 4 year weights 1999-2002,LAB,0,0
SSB2M,Beta 2 Microglobulin (mg/L) (surplus),LAB,0,0
SSB2ML,Beta 2 Microglobulin comment code,LAB,0,0
SSCYST,Cystatin C (mg/L) (surplus),LAB,0,0
SSCYSTL,Cystatin C comment code,LAB,0,0
SSGALB,Glycated Albumin (g/dL) (surplus),LAB,0,0
SSGALBL,Glycated Albumin comment code,LAB,0,0
SSALB,Albumin (g/dL) (surplus),LAB,0,0
SSALBL,Albumin comment code,LAB,0,0
SSGALBP,Percent glycated albumin% (surplus),LAB,0,0
SSPRIS,Pristine sample (surplus),LAB,0,0
LBXHA,Hepatitis A antibody,LAB,0,0
LBXHBS,Hepatitis B surface antibody (not in NHANES 01-02),LAB,0,0
LBXHBC,Hepatitis B core antibody ,LAB,0,0
LBDHBG,Hepatitis B surface antigen,LAB,0,0
LBDHCV,Hepatitis C antibody confirmed,LAB,0,0
LBXHCR,Hepatitis C RNA,LAB,0,0
LBDHD,Hepatitis D (antiHDV),LAB,0,0
WTSSCB2Y,Cardiac biomarkers 2 year weights (surplus) (newly added Sep 2022 - SSTROP_A),LAB,0,0
